keyid,filename,title,creator,date,publisher not identified,publisherloc,publisher2,publisher2loc,distributor,distloc,edition,illustration,pages,size,series,volume,seriesadd,volumeadd,note,translatedfrom,bibliography,contents,summary,subjects,type,format,language,display_template
hk0420,placeholder.jpg,Sickly sweet,"Hershkowitz, M M (Menachem Mendel);Bar-Lev, Dan",2021,Lechaim Productions,"Brooklyn, NY",,,,,,color illustrations,81 pages,,,,,,,,,,,Candy;Jewish religious education;Belgium;Jewish boys;Graphic novels,Image;StillImage,image/jpeg,eng,item
hk0421,placeholder.jpg,Lost in London,"Yarhi, G'aki;Hershkowitz, M M (Menachem Mendel)",2022,Lechaim Productions,"Brooklyn, NY",,,,,,color illustrations,69 pages,35 cm,,,,,,,,,,England;London (England);Missing children;Fathers and sons;Christianity and other religions;Judaism;Graphic novels;Haredi and religious literature;Fiction,Image;StillImage,image/jpeg,eng,item
hk0422,placeholder.jpg,The helping heroes,"Havlin, B Sh",2022,Lechaim Productions,"Brooklyn, NY",,,,,,color illustrations,63 pages,35 cn,,,,,,,,,"""Shloimy Schwartz always dreamed of being part of a club, but with no friends in school ... who'd want to join him? When a hurricane threatens his small town, Shloimy knows just what they all need: a Helping Heroes club - a group of strong, smart, brave and resourceful kids who will help the residents deal with the storm and its results. But his plans seem to hit a snag when Shmuel, Shmaya, and Shaul walk into his room ...The four boys head out on a wild, heart-stopping journey in which they not only save Shloimy's father, but learn valuable lessons about disability, dealing with challenges, and accepting those who are different than us."" -- Judaica Place website.",Jewish religious education;Storms;Heroes;Fathers and sons;Helping behavior;Children with disabilities;Action and adventure;Graphic novels,Image;StillImage,image/jpeg,eng,item
hk0423,placeholder.jpg,Time travelers,"Einhorn, P H;Segelowitz, S",2022,Lechaim Productions,"Brooklyn, NY",,,,,,color illustrations,68 pages,35 cm,,,,,,,,,"""Did you ever read a book ... only to have the main character suddenly pop out and invite you to go back with him to his village? No? Well, the Landau kids did. Efraim's invitation comes just as the Landau kids are contemplating his sad existence - the hunger, the fear, the heartless poritz ... and yet nothing about Efraim's happy smile and cheerful demeanor seems to match their expectations. How is it even possible? With so many painful things to deal with, and no toys or nosh or even enough food - how can he not be sad? Join the Landau family as they travel back in time to Efraim's long-ago village. Cheer them on as they devise a courageous plan to thwart the wicked poritz's plot, and learn along with them what it is that truly makes a Yid happy."" -- Judaica Place website.",Jewish families;Soviet Union;Action and adventure;Graphic novels;Time travel;Historical fiction,Image;StillImage,image/jpeg,eng,item
hk0424,placeholder.jpg,Yael's loving world,"Weinstock, Malky;Pileggi, Steve",2011,LITE Child Enterprises,"Brooklyn, NY",Judaica Press,"Brooklyn, NY",,,,color illustrations,1 volume,28 cm + 1 audio disc,LITE Girl,,,,Compact disc.,,,,"Yael appreciates all the people in her life, and Hashem, who brings them all to her.",Families;God (Judaism);Fiction,Image;StillImage,image/jpeg,eng,item
hk0425,placeholder.jpg,Rebel with a cause : one woman's desperate search for meaning and truth,"Djalilmand, Shira Yehudit",2016,Mekor Press,"Brooklyn, NY",Menucha Publishers,,,,,,245 pages,24 cm,,,,,,,,,"""I stood alone on the pavement, suitcase in hand, staring at the closed door of my house. As far I was concerned, my home was gone forever. So begins Shira Yehudit Djalilmand's riveting story of her life, a story which begins in a small, dusty manufacturing town in the West Midlands of England and takes us on a tumultuous journey through her rebellious teenhood to her wanderings in Morocco, across the Spanish countryside, and eventually to a kibbutz in the Negev. Searching desperately for some meaning to her existence, this Christian-born young woman wrestles with the deepest questions of mankind and nearly despairs of finding the answers that would bring peace to her tortured soul. When she finally finds that peace, her questions fall away in the face of the enormity of the gift she'd been given...the gift of Torah and Judaism. Rebel with a Cause, by talented and popular Mishpacha writer Shira Yehudit Djalilmand, is an eye-opening, gut-wrenching memoir, amazing in its honesty and in its author's quest for truth.""--Page [4] of cover","Jewish converts;Jewish women;Israel;Biography;Djalilmand, Shira Yehudit",Image;StillImage,image/jpeg,eng,item
hk0426,placeholder.jpg,The boy who loved Torah : the story of Rav Chaim Kanievsky,"Ungar, Carol;Ackerman, Dena",2023,Menucha Publishers,"Brooklyn, NY",Menucha Classroom Solutions,,,,,illustrations,42 pages,22 cm,Young readers biography,,,,,,,,,"Rabbis;Israel;Jewish scholars;Jewish religious education;Talmud Torah;Biography;Kanevski, Shemaryahu Yosef Hayim ben Y Y",Image;StillImage,image/jpeg,eng,item
hk0427,placeholder.jpg,Journey on the C & O Canal,"Yavin, Tovah S",2021,Menucha Publishers,"Brooklyn, NY",Menucha Classroom Solutions,,,,,,247 pages,,,,,,,,,,,Jewish youth;Mules;Animals;United States;History;20th century;Jewish boys;Haredi and religious literature;Fiction;Religious fiction,Image;StillImage,image/jpeg,eng,item
hk0428,placeholder.jpg,There's a frog on my stage!,"Kramer, Chaya;Massry, Sarah;Zee, Sarah",2022,Menucha Publishers,"Brooklyn, NY",,,,,,color illustrations,26 pages,27 cm,,,,,,,,,"""A BRIGHT SUN is shining on a hot summer day. My friends are all gathered for the world's greatest play. A group of boys work hard building a stage, writing a script, and composing songs. Everything is perfect and ready for the grand performance. But something goes wrong. Now what will they do? An original and engaging story that will equip children with tools to handle unexpectedchallenges. Written by professional educators, with lively illustrations by talented illustrator Sarah Zee, this book offers a powerful message in an entertaining way."" -- Publisher's website.",Frogs;Adjustment (Psychology);Judaism;Children's theater;Stories in rhyme;Fiction,Image;StillImage,image/jpeg,eng,item
hk0429,placeholder.jpg,Word fun for everyone : kosher word games,"EhrlichKlein, Tzvia",2018,Menucha Publishers,"Brooklyn, NY",,,,,,,175 pages,22 cm,,,,,"""Over 500 puzzles & riddles""--Cover.",,,,,Word games,Image;StillImage,image/jpeg,eng,item
hk0430,placeholder.jpg,Shimmy's magical visit to Shareland,"Melekh, Bat",2022,Menucha Publishers,"Brooklyn, NY",,,,,,color illustrations,37 pages,28 cm,,,,,,,,,,Sharing;Conduct of life;Fiction,Image;StillImage,image/jpeg,eng,item
hk0431,placeholder.jpg,Yarmulkes for sale,"Heller, Esther Susan;Barshishat, Malka Michaela",2022,Menucha Publishers,"Brooklyn, NY",,,,,,color illustrations,25 pages,29 cm,,,,,Inspired by: Slobodkina Esphyr 1908-2002 Caps for sale,,,,"""Once there was a traveling salesman selling yarmulkes on top of his head!So begins the delightful tale of Yarmulkes for Sale, a creative spin on a beloved story."" -- Publisher's website.",Peddlers;Yarmulkes;Lag b'Omer;Haredi and religious literature;Picture books,Image;StillImage,image/jpeg,eng,item
hk0432,placeholder.jpg,Traffic jam hero,"Brander, Ellen;Brander, Batyah;Ackerman, Dena",2022,Menucha Publishers,"Brooklyn, NY",,,,,,color illustrations,1 volume,26 cm,,,,,,,,,,Traffic;Sabbath;Jewish families;Stories in rhyme;Fiction,Image;StillImage,image/jpeg,eng,item
hk0433,placeholder.jpg,I live with my mommy,"EhrlichKlein, Tzvia;Ackerman, Dena",2014,Menucha Publishers,"Brooklyn, NY",,,,,,illustrations,32 pages,,,,,,,,,,,Children of divorced parents;Religious life;Judaism;Orthodox Jews,Image;StillImage,image/jpeg,eng,item
hk0434,placeholder.jpg,Flight to freedom : the true story of a family's escape from war-torn Belgium,"Worch, Renee",2018,Menucha Publishers,"Brooklyn, NY",,,,,1st edition,,319 pages,24 cm,,,,,,,,,,"Holocaust, Jewish (1939-1945);Belgium;Antwerp (Belgium);Personal narratives",Image;StillImage,image/jpeg,eng,item
hk0435,placeholder.jpg,Escape From Iran : two Jewish girls story of survival,"Djalilmand, Shira Yehudit",2019,Menucha Publishers,"Brooklyn, NY",,,,,,,114 pages,22 cm,,,,,,,,,"""Iran in the 1980s has become a dangerous place for Jews to live. Twin sisters Pari and Maheen have a chance to leave home for a better life in the West. But it will mean saying goodbye to their parents, siblings, relatives, and friends. The trip will be fraught with danger. They'll have to sneak across hostile borders and avoid informers who could report them to the police. Should they take the chance? This is the true story of two girls who make a courageous decision. Join them on their harrowing escape to a land where they can be free. Readers will be fascinated to learn more about Iran's once-thriving community and the political changes that resulted in the girls' determination to escape from Iran.""--Back cover",Jewish girls;Iran;Emigration and immigration;Women refugees;Ethnic relations;Twins;Israel;20th century;Autobiography,Image;StillImage,image/jpeg,eng,item
hk0436,adams_humongoussnowstorm.jpg,Penina Farina and the humongous snowstorm,"Adams, Fradl;Simon, Mira",2021,Menucha Publishers,"Brooklyn, NY",,,,,,,84 pages,,,,,,,,,,,Penina Farina (Fictitious character);Girls;Pasta products;Jewish girls;Children's humourous stories;Humorous stories;Storms;Fiction,Image;StillImage,image/jpeg,eng,item
hk0437,placeholder.jpg,From ram to shofar,"Goldish, Meish",2022,Menucha Publishers,"Brooklyn, NY",,,,,,color illustrations,24 pages,25 cm,,,,,,,,,"""How is a shofar made? Follow its amazing journey from a ram roaming in a field to a shofar blown on Rosh Hashanah."" -- Publisher's website.",Shofar;History,Image;StillImage,image/jpeg,eng,item
hk0438,placeholder.jpg,Menucha for Menucha,"Walfish, Yael;Simon, Mira",2022,Menucha Publishers,"Brooklyn, NY",,,,,,illustrations,31 pages,28 cm,,,,,,,,,,Jewish girls;Temper tantrums;Self-control;Judaism;Fiction,Image;StillImage,image/jpeg,eng,item
hk0439,placeholder.jpg,Double secret in Qasir,"Stern, F;Zilberman, C",2023,Menucha Publishers,"Brooklyn, NY",,,,,,color illustrations,85 pages,,,,,,,,,,,Jewish boys;Orphans;Orphanages;Jewish ethics;Kidnapped children;Action and adventure;Jewish way of life;Graphic novels,Image;StillImage,image/jpeg,eng,item
hk0440,placeholder.jpg,Seattle to strawberries : A teen novel,"Zimmerman, Chaya Rochel",2023,Menucha Publishers,"Brooklyn, NY",,,,,,,270 pages,,,,,,,,,,,Jewish fiction;Jewish teenagers;Jewish families;Best friends;Friendship;Young adult fiction;Moving household;Schools;Fiction,Image;StillImage,image/jpeg,eng,item
hk0441,placeholder.jpg,Stormy waters : a teen novel,"Herbst, Devorah",2023,Menucha Publishers,"Brooklyn, NY",,,,,,,212 pages,24 cm,,,,,,,,,,Jewish girls;Jewish families;Best friends;Friendship;Teenage girls;Schools;Young adult fiction;Jewish fiction,Image;StillImage,image/jpeg,eng,item
hk0442,placeholder.jpg,Flights of the doves : A novel,"Garber, Susie",2023,Menucha Publishers,"Brooklyn, NY",,,,,,,316 pages,24 cm,,,,,,,,,,"Holocaust, Jewish (1939-1945);Jewish families;Families;Jewish girls;Paris (France);New York City;France;New York State;United States;Warsaw (Poland);Poland;Fiction;Historical fiction",Image;StillImage,image/jpeg,eng,item
hk0443,adams_cleanupcampaign.jpg,Penina Farina and the cleanup campaign,"Adams, Fradl;Simon, Mira",2023,Menucha Publishers,"Brooklyn, NY",,,,,,,144 pages,22 cm,,,,,,,,,"""Penina Farina is just as bouncy as ever! When Mommy trips over a mess on the floor and hurts her back, Tatty steps in to create a cleanup plan for the Farina family, including hiring Sara Marinara, a mysterious housekeeper. But the Farina home is not the only messy place in town. Can Mayor Lasagna's contest for the kids of Catchupspill Valley succeed? Will the streets be clean in time for Governor Cavatappi's visit? Penina Farina and the Cleanup Campaign is the second book in this entertaining series by Fradl Adams. This irresistible story will show readers that a little glitter and a lot of laughter can make anything fun--even cleaning up!"" -- JudaicaPlace.com.",Penina Farina (Fictitious character);Jewish girls;Refuse and refuse disposal;Orderliness;Fiction,Image;StillImage,image/jpeg,eng,item
hk0444,meyer_starlight.jpg,Starlight : a novel,"Meyer, Henye",2015,Menucha Publishers,"Brooklyn, NY",,,,,,,286 pages,,,,,,"""Dedicated to Sir Moses Montefiore, Lady Judith Montefiore, true ohavei Yisrael"".",,,,,Jewish girls;England;Social life and customs;Manners and customs;19th century;Fiction,Image;StillImage,image/jpeg,eng,item
hk0445,placeholder.jpg,Unpaid ransom,"Lehmann, Marcus 1831-1890;Mindel, Nissan;Kleinman, Zalman",1992,Merkos L'Inyonei Chinuch,"Brooklyn, NY",,,,,Revised edition,illustrations,74 pages,24 cm,,,,,,,,,"The story of Rabbi Meir of Rothenberg, one of the leading Torah scholars of European Jewry. When the Count of Hohenberg listens to the advice of the apostate Kempe [Kneppe] to extort more taxes out of the Jewish ghetto in Rothenberg, Rabbi Meir left Germany with family and followers. He was captured in the mountains and imprisoned in a fortress near Ensisheim in Alsace. Tradition has it that a large ransom of 23,000 marks silver was raised for him (by the Rosh), but Rabbi Meir refused it, for fear of encouraging the imprisonment of other rabbis. He died in prison after seven years. Fourteen years after his death a ransom was paid for his body so he could be burried in a Jewish cemetary.","History;843-1273;Persecutions;Pidyon shevuyim;Germany;Jewish religious fiction;Biography;Fiction;Meir ben Baruch, of Rothenburg, approximately 1215-1293",Image;StillImage,image/jpeg,eng,item
hk0446,placeholder.jpg,The money in the honey,"Backman, Aidel",2003,Merkos L'Inyonei Chinuch,"Brooklyn, NY",,,,,,color illustrations,30 pages,29 cm,,,,,"The Money in the Honey was originally published in Talks & Tales, editor Nissan Mindel, under the name The Jars of Honey.",,,,"""A widow's fortune has been stolen. Can young King David solve the mystery?-- Provided by publisher.","Bible stories;Good and evil;David, King of Israel;Fiction",Image;StillImage,image/jpeg,eng,item
hk0447,placeholder.jpg,"The call of the shofar, and other stories","Sharfstein, Chana;Mindel, Nissan;Kleinman, Zalman",1971,Merkos L'Inyonei Chinuch,"Brooklyn, NY",,,,,,color illustrations,64 pages,24 cm,,,,,,,,,"A collection of four stories, including ""The Mirror,"" ""The Bride,"" ""The Little Tyrant,"" and the title story.",Fiction,Image;StillImage,image/jpeg,eng,item
hk0448,placeholder.jpg,Tiny treasures : the wonderful world of a Jewish child,"Rosenfeld, Dina Herman;Waldham, Bryna",1988,Merkos L'Inyonei Chinuch,"Brooklyn, NY",,,,,,color illustrations,25 pages,30 cm,,,,,,,,,"Brief poems describe cherished symbols of Jewish life, such as mitzvos, shabbos candle, escrog, and mezuza.",Jewish religious poetry,Image;StillImage,image/jpeg,eng,item
hk0449,placeholder.jpg,The coachman : and other stories,"Kranzler, Gershon;Kleinman, Zalman",1992,Merkos L'Inyonei Chinuch,"Brooklyn, NY",,,,,,illustrations,168 pages,22 cm,,,,,"""Formerly published as Galuth melodies, volume 2""--Title page verso.",,,,A collection of short stories about Rabbi Baruch and his disciples and from days bygone.,Folklore,Image;StillImage,image/jpeg,eng,item
hk0450,placeholder.jpg,Quarters & dimes & nickels & pennies,"Olidort, Baila;Nodel, Norman",1993,Merkos L'Inyonei Chinuch,"Brooklyn, NY",,,,,,color illustrations,1 volume,25 cm,,,,,,,,,David cannot understand how filling his charity box with coins will help poor people until his mother takes him downtown to deliver the money to a soup kitchen.,Charity;Jewish ethics;United States;Charity laws and legislation (Jewish law);Habad;Fiction,Image;StillImage,image/jpeg,eng,item
hk0451,placeholder.jpg,When I fell into my Kiddush cup,"Fridman, Sashi;Kranz, Sarah",1999,Merkos L'Inyonei Chinuch,"Brooklyn, NY",,,,,,color illustrations,1 volume,27 cm,,,,,,,,,"A boy falls into his Kiddush cup and is transported to Kiddush Cup Land, where he discovers all the sacred uses of wine in the Jewish religion.",Kiddush cups;Customs and practices;Fiction,Image;StillImage,image/jpeg,eng,item
hk0452,placeholder.jpg,Fishy Friday,"Fridman, Sashi;Klausner, April Stewart",2000,Merkos L'Inyonei Chinuch,"Brooklyn, NY",,,,,,color illustrations,1 volume,27 cm,,,,,,,,,"On Friday, kosher fish compete for the honor of being caught by fishermen and served at the Sabbath meal.",Sabbath;Fishes;United States;Fiction;Stories in rhyme;Picture books,Image;StillImage,image/jpeg,eng,item
hk0453,fridman_lastpairshoes.jpg,The last pair of shoes,"Fridman, Sashi;Seva",2005,Merkos L'Inyonei Chinuch,"Brooklyn, NY",,,,,,color illustrations,29 pages,26 cm,,,,,,,,,"Shalva, a young orphan struggling to support his family in war-torn Europe, becomes a shoemaker and sacrifices his own comfort by giving away his last pair of shoes to a needy stranger.",Shoes;Shoemakers;Fiction,Image;StillImage,image/jpeg,eng,item
hk0454,placeholder.jpg,The doll maker's gift,"Fridman, Sashi;Schiffman, Jessica",2011,Merkos L'Inyonei Chinuch,"Brooklyn, NY",,,,,,color illustrations,35 pages,26 cm,,,,,,,,,"""When Pogroms in Eastern Europe force little Nora's family to flee to America, they discover at the last moment that they haven't enough funds to pay for everyone's passage. One of them will have to stay behind. The decision is difficult, and Nora is to be left with a family friend, a kind doll maker who offers to care for her until they can earn enough money to pay for her journey. Nora's mother is beside herself, heartbroken about leaving her youngest--yet the devoted doll maker shows that good friends are priceless and that all obstacles can be overcome when there is a true desire to help another.""--Publisher.",Dollmakers;Dolls;Persecutions;Russia;History;1904-1914;Fiction,Image;StillImage,image/jpeg,eng,item
hk0455,placeholder.jpg,The storyteller : selected short stories,"Mindel, Nissan;Dershowitz, Yosef",1981-1984,Merkos L'Inyonei Chinuch,"Brooklyn, NY",,,,,,illustrations,2 volumes,24 cm,,,,,Vol. 2 illustrated by Yosef Dershowitz.,,Includes bibliographical references.,,"A collection of stories celebrating the Jewish tradition in many different places and different times, some reconstructed from actual events, some based on tradition, and some fictional in form.",Customs and practices,Image;StillImage,image/jpeg,eng,item
hk0456,placeholder.jpg,The complete story of Tishrei,"Mindel, Nissan",1982,Merkos L'Inyonei Chinuch,"Brooklyn, NY",,,,,Revised edition,,,,,,,,"""Is a companion to the popular Complete festival series by the same author""--Preface;Includes index.",,,,"A comprehensive presentation of the events of Tishrei, the first month of the Jewish calendar, which includes such highlights as Rosh Hashanah, Yom Kippur, and Sukkot.",Tishrei;Fasts and feasts;Judaism,Image;StillImage,image/jpeg,eng,item
hk0457,placeholder.jpg,Hershel's houseboat,"Muchnik, Michoel",1984,Merkos L'Inyonei Chinuch,"Brooklyn, NY",,,,,Revised color edition,color illustrations,48 pages,19 cm,,,,,,,,,Mendel and Rachel have a happy day with Hershel on his houseboat and with their friend Berel who sings about the omnipresence of Hashem for everyone around to hear.,Judaism;History,Image;StillImage,image/jpeg,eng,item
hk0458,placeholder.jpg,The great Mitzvah fair,"Muchnik, Michoel;Colish, Chana",1982,Merkos L'Inyonei Chinuch,"Brooklyn, NY",,,,,,color illustrations,13 leaves,17 x 33 cm,,,,,,,,,"A fantasy fair, featuring a flying Seder plate, a slide shaped like a giant mezuzah, and other aspects of Jewish culture, brings delight to a town and then moves on.",Fairs;Customs and practices;Jewish themes in children's literature,Image;StillImage,image/jpeg,eng,item
hk0459,placeholder.jpg,The broken bracelet : a historical novel,"Kranzler, Gershon",1986,Merkos L'Inyonei Chinuch,"Brooklyn, NY",,,,,1st revised edition,illustrations,218 pages,23 cm,,,,,,,,,"To escape the persecution of the Inquisition, the four members of Rabbi Zacuto's family leave Lisbon for Constantinople but become separated on the way and are only reunited after many years of harrowing adventures.",Inquisition;History;70-1789;Fiction,Image;StillImage,image/jpeg,eng,item
hk0460,placeholder.jpg,The storyteller : selected short stories,"Mindel, Nissan;Kleinman, Zalman;Dershowitz, Yosef",1986-1998,Merkos L'Inyonei Chinuch,"Brooklyn, NY",,,,,2nd edition,illustrations,"volumes 1, 3-5",24 cm,,,,,Vol. <3> illustrated by Yosef Dershowitz.;Vol. 3-<5> lack edition statement.,,Includes bibliographical references.,,A collection of forty Hasidic legends and tales dealing with traditional holidays and others aspects of Jewish history and experience.,Hasidim;Legends;Jewish parables;Fasts and feasts;Judaism;Folklore;Hasidic parables,Image;StillImage,image/jpeg,eng,item
hk0461,placeholder.jpg,The glass blower of Venice and other stories,"Kranzler, Gershon;Waldman, Bryna",1988,Merkos L'Inyonei Chinuch,"Brooklyn, NY",,,,,,illustrations,96 pages,23 cm,,,,,,,,The glass blower of Venice -- The boar hunt -- The lens grinder of the Yooden Gracht -- Once upon a Passover night -- Don Pereira of Boston -- The island of hope.,A collection of short stories depicting Jews throughout history.,Jewish themes in children's literature;History,Image;StillImage,image/jpeg,eng,item
hk0462,placeholder.jpg,The precious little spicebox and other stories,"Kranzler, Gershon;Waldman, Bryna",1988,Merkos L'Inyonei Chinuch,"Brooklyn, NY",,,,,,illustrations,109 pages,23 cm,,,,,,,,,A collection of short stories depicting Jews throughout history.,Jewish themes in children's literature;History,Image;StillImage,image/jpeg,eng,item
hk0463,placeholder.jpg,The secret of success and other stories,"Sharfstein, Chana;Mindel, Nissan;Kleinman, Zalman",1990,Merkos L'Inyonei Chinuch,"Brooklyn, NY",,,,,,,,,,,,,,,,,"A collection of six stories, including ""The Precious Pears,"" ""The Poor Woodcutter and the Thief,"" and ""The Reward.""",,Image;StillImage,image/jpeg,eng,item
hk0464,placeholder.jpg,The very best place for a penny,"Rosenfeld, Dina Herman;Pinchevsky, Leonid;Meshchaninov, Eliyahu",1984,Merkos L'Inyonei Chinuch,"Brooklyn, NY",,,,,,color illustrations,32 pages,22 x 26 cm,,,,,,,,,"Emphasizes the mitzvah or Jewish commandment of giving charity, through the tale of a penny in a drawer contemplating the very best place for himself.",Charity;Jewish ethics;Commandments (Judaism),Image;StillImage,image/jpeg,eng,item
hk0465,placeholder.jpg,The ArtScroll children's Haggadah,"Blitz, Shmuel;Katz, Tova",2000,Artscroll Mesorah Publications,"Brooklyn, NY",The Living Memorial c/o Hebrew Academy of Cleveland,"Cleveland, OH",,,1st edition,color illustrations,95 pages,29 cm,Artscroll Youth series,,,,,,,,,Haggadot;Seder;Liturgy;Judaism;Bilingual;Liturgical texts,Image;StillImage,image/jpeg,eng,item
hk0466,placeholder.jpg,[Megilat Ester] = The ArtScroll children's Megillah,"Blitz, Shmuel;Katz, Tova;Scherman, Nosson",2003,Artscroll Mesorah Publications,"Brooklyn, NY",,,,,1st edition,color illustrations,79 pages,29 cm,Artscroll Youth series,,,,,,,,"This ArtScroll edition of the Book of Esther is designed especially for young people. With a streamlined translation of the classic Judaic text, appealing color illustrations, clear instructions, and illuminating comments.",Jewish religious education;Bilingual;Commentaries;Illustrated works,Image;StillImage,image/jpeg,eng,item
hk0467,placeholder.jpg,"Tales of tzaddikim : a wonderful collection of stories from our sages and the great Torah and Chassidic leaders. [Vol. 3, Vayikra]","Mah-Tov, G;Bardugo, Miryam",1988,Artscroll Mesorah Publications,"Brooklyn, NY",,,Hamesorah,Jerusalem,2nd edition,illustrations,310 pages,24 cm,Tales of tzaddikim,3,Artscroll Youth series,,"Indexes to the set of Tales of tzaddikim found in vol. 5, Devarim.",Maasehem shel tsadikim;Hebrew,,,,Jewish legends;Rabbis;Legends;Hasidim;Jewish parables;Folklore,Image;StillImage,image/jpeg,eng,item
hk0468,placeholder.jpg,"Tales of tzaddikim : a wonderful collection of stories from our sages and the great Torah and Chassidic leaders. [Vol. 5, Devarim]","Mah-Tov, G;Bardugo, Miryam",1988,Artscroll Mesorah Publications,"Brooklyn, NY",,,Hamesorah,Jerusalem,2nd edition,illustrations,343 pages,24 cm,Tales of tzaddikim,,Artscroll Youth series,,"Indexes to the set of Tales of tzaddikim found in vol. 5, Devarim.",Maasehem shel tsadikim;Hebrew,,,,Jewish legends;Rabbis;Legends;Hasidim;Jewish parables;Folklore,Image;StillImage,image/jpeg,eng,item
hk0469,placeholder.jpg,Tales of tzaddikim : a wonderful collection of stories from our sages and the great Torah and Chassidic leaders,"Mah-Tov, G;Bardugo, Miryam",1987-1988,Artscroll Mesorah Publications,"Brooklyn, NY",,,Hamesorah,Jerusalem,1st edition,illustrations,5 volumes,24 cm,Artscroll Youth series,,,,Translation of: MaasÌehem shel tsadikim.,,,[1] Bereishis -- [2] Shemos -- [3] Vayikra -- [4] Bamidbar -- [5] Devarim.,,Jewish legends;Rabbis;Legends;Hasidim;Jewish parables;Folklore,Image;StillImage,image/jpeg,eng,item
hk0470,placeholder.jpg,The Arizal : the life and times of Rabbi Yitzchak Luria,"Piontac, Nechemiah;Bardugo, Miryam",1988,Artscroll Mesorah Publications,"Brooklyn, NY",,,Hamesorah,Jerusalem,1st edition,illustrations,288 pages,24 cm,Artscroll Youth series,,,,Translation of: Arizal.,,Includes bibliographical references.,,A biography of the rabbi who labored to instill among his disciples the teachings and practices of the Kabbalah.,"Rabbis;Israel;Tsefat (Israel);Cabala;Biography;Luria, Isaac ben Solomon, 1534-1572",Image;StillImage,image/jpeg,eng,item
