keyid,filename,title,creator,date,publisher not identified,publisherloc,publisher2,publisher2loc,distributor,distloc,edition,illustration,pages,size,series,volume,seriesadd,volumeadd,note,translatedfrom,bibliography,contents,summary,subjects,type,format,language,display_template
hk1272,placeholder.jpg,Class-ified information 3 : 3 books in 1!,"Millman, M C",2016,Jerusalem Publications,"Jerusalem, Israel",,,Feldheim Publishers,"Nanuet, New York",,,445 pages,22 cm,Class-ified information,,,,"Three previously published books collected in one volume.;Yaffa Pollack, 2007;Rena Jaffe 2008;Perel Waldman 2009.",,,Naomi Lustig -- Esther Heller -- Aliza Isaacs.,,Jewish girls;Jewish day schools;Friendship;Jewish religious education of girls;Fiction,Image;StillImage,image/jpeg,eng,item
hk1273,placeholder.jpg,Y.A.D. investigators,"Wisemon, Tamar;Katz, Tova",2002,Jerusalem Publications,"Jerusalem, Israel",,,Feldheim Publishers,"Nanuet, NY",,illustrations,239 pages,24 cm,,,,,Short mystery stories.,,,,,Jewish boys;Jewish way of life;Fiction,Image;StillImage,image/jpeg,eng,item
hk1274,placeholder.jpg,Donny Duckling finds a friend,"Fuchs, Menuchah;Rappaport, Aviva;Perlov, Ahuvah",2002,Kav L'kav Menucha Fuchs Books,"Jerusalem, Israel",,,Judaica Press,"Brooklyn, NY",,color illustrations,32 pages,24 cm,,,,,Translation from Hebrew.;Name of Ahuvah Perlov is in Hebrew characters.,,,,Yossi thinks that you acquire friends by giving them prizes.,Friendship;Jewish religious education;Israel;Fiction,Image;StillImage,image/jpeg,eng,item
hk1275,placeholder.jpg,Who will be king of the jungle?,"Fuchs, Menuchah;Rappaport, Aviva;Perlov, Ahuvah",2002,Kav L'kav Menucha Fuchs Books,"Jerusalem, Israel",,,Judaica Press,"Brooklyn, NY",,color illustrations,32 pages,24 cm,,,,,Translation of: Mi yihyeh melekh ha-yaar?;Name of Ahuvah Perlov is in Hebrew characters.,,,,The girls hear a story about animals who take turns being king of the jungle.,Sharing;Jewish religious education;Israel;Fiction,Image;StillImage,image/jpeg,eng,item
hk1276,placeholder.jpg,Levi and the little loaf,"Fuchs, Menuchah",2005,Kav L'kav Menucha Fuchs Books,"Jerusalem, Israel",,,Judaica Press,"Brooklyn, NY",,illustrations,32 pages,24 cm,Tell me a story,,,,,Hebrew,,,,Jewish way of life;Fiction,Image;StillImage,image/jpeg,eng,item
hk1277,placeholder.jpg,Proud to be prickly,"Fuchs, Menuchah",2005,Kav L'kav Menucha Fuchs Books,"Jerusalem, Israel",,,Judaica Press,"Brooklyn, NY",,,32 pages,25 cm,Tell me a story,,,,,Hebrew,,,,Bashfulness;Porcupines;Fiction,Image;StillImage,image/jpeg,eng,item
hk1278,placeholder.jpg,Shira the sheep loses her way,"Fuchs, Menuchah",2005,Kav L'kav Menucha Fuchs Books,"Jerusalem, Israel",,,Judaica Press,"Brooklyn, NY",,,32 pages,24 cm,Tell me a story,,,,,Hebrew,,,,Sheep;Picture books;Fiction,Image;StillImage,image/jpeg,eng,item
hk1279,placeholder.jpg,Kligerovka : A one-of-a-kind village,"Irenstein, Hadas",2021,Kosher Comics,"Jerusalem, Israel",,,,,,color illustrations,69 pages,,,,,,,,,,,Jewish religious education;Village communities;Conduct of life;Graphic novels,Image;StillImage,image/jpeg,eng,item
hk1280,placeholder.jpg,Escape! 4 : an action packed story of faith and providence,"Ohayon, Avraham;Bar-Lev, Dan;David, Brocha",2023,Feldheim Publishers,"Jerusalem, Israel;Nanuet, NY",,,,,,chiefly color illustrations,90 pages,31 cm,,,,,,,,,"""In Escape!, the partisans returned to Germany and stole the Nazi plans for an atomic bomb. During the daring and risky mission, they found an antique golden mezuzah cover in the Nazi's Tunnel of Stolen Gold. They trained for further missions and, having joined U.S. naval forces heading out to the Pacific, were attacked by the Japanese. Meanwhile, Moshe Heiman, an innocent Jewish refugee in Japan was found guilty of being a spy. He was sent with the Japanese attacking force as a human shield, and rescued by the partisans. Why is Moshe surprised to see the golden mezuzah cover? What does it have to do with Franz Mueller, a former Nazi? How can they escape a German and Japanese massive manhunt? Join us in Escape! 4 for another spine-tingling adventure with awe-inspiring emunah on every page!""--Amazon.com.","Escaped prisoners of war;World War II, 1939-1945;Underground movements;Holocaust, Jewish (1939-1945);War;Action and adventure;Graphic novels;Fiction;Historical fiction;War stories",Image;StillImage,image/jpeg,eng,item
hk1281,ohayon_titanic6.jpg,"Titanic 6 : to turn the tide : the ""unsinkable"" Moshe Wallas faces turbulent challenges in the Holy Land","Ohayon, Avraham;Bar-Lev, Dan;Bar-Lev, Yoel;David, Brocha",2023,Feldheim Publishers,"Jerusalem, Israel;Nanuet, NY",,,,,,chiefly color illustrations,94 pages,31 cm,,,,,,,,,,Rabbis;Religious comics;Historical fiction;Graphic novels,Image;StillImage,image/jpeg,eng,item
hk1282,placeholder.jpg,The secret key,"Einhorn, P H;Halevi, Isaac",2023,Shai Publishing,"Jerusalem, Israel",,,,,,color illustrations,66 pages,33 cm,,,,,,,,,,Italy;Venice (Italy);Jewish families;Jewish religious education;Heroes;Action and adventure;Graphic novels;Historical fiction;Religious comics,Image;StillImage,image/jpeg,eng,item
hk1283,placeholder.jpg,Our guiding light : in the footsteps of our gedolim. Volume I,"Weiss, Naftali Mosheh;Heler, Moti;Reich, Pessy",2020,Tiferet Publishers,"Jerusalem, Israel",Lechaim Productions,"Brooklyn, NY",,,,color illustrations,67 pages,34 cm,,,,,As serialized in Kindlayn.,,,,,Rabbis;Eastern Europe;Zaddikim;Israel;Graphic novels;Biography,Image;StillImage,image/jpeg,eng,item
hk1284,placeholder.jpg,"Yitzy, Pitzy and Tzippy","Fridman, H;Havlin, B Sh",2020,Tiferet Publishers,"Jerusalem, Israel",,,,,,color illustrations,volumes,31 cm,,,,,As serialized in Kindlayn.,,,,"""Yitzy and Pitzy are building a birdhouse. Wait, who is flying over there? Who came to visit? Tzippy is a unique kind of bird. She speaks, she's smart, and she knows a whole lot of concepts! Take flight from one story to the next as she carries Yitzy and Pitzy on her wings. Watch and learn from their fascinating adventures, and discover how to behave with proper derech eretz. Join Yitzy, Pitzy and Tzippy on their adventures. Laugh, enjoy, and learn too!"" -- back cover.",Israel;Graphic novels;Religious comics,Image;StillImage,image/jpeg,eng,item
hk1285,placeholder.jpg,Hidden leaflets : the life and legacy of the great commentator Rashi hakadosh,"Hershkowitz, M M (Menachem Mendel);Eisenstein, C;Reich, Pessy",2020,Tiferet Publishers,"Jerusalem, Israel",Lechaim Productions,"Brooklyn, NY",,,,color illustrations,60 pages,34 cm,,,,,,,,,,"Conduct of life;Jewish way of life;Birds;Jewish religious education;Israel;Haredi and religious literature;Graphic novels;Biography;Rashi, 1040-1105",Image;StillImage,image/jpeg,eng,item
hk1286,placeholder.jpg,"Hey, Corona! : who are you anyway?","Walder, Chaim;Raanan, Ahuva;Rappaport, Aviva",2020,Feldheim Publishers,"Jerusalem, Israel;Nanuet, NY",,,,,,color illustrations,1 volume,21 cm,,,,,"""For kids & parents"" -- Title page.",,,,,"COVID-19 Pandemic, 2020-2023",Image;StillImage,image/jpeg,eng,item
hk1287,placeholder.jpg,Let's go free with Miri & Tzvi : children's Haggadah,"Berzon, Devorah",2015,Feldheim Publishers,"Jerusalem, Israel;Nanuet, NY",,,,,,color illustrations,108 pages,31 cm,,,,,,,,,,Haggadot;Seder;Liturgy;Judaism;Passover;Liturgical texts,Image;StillImage,image/jpeg,eng,item
hk1288,placeholder.jpg,"Titanic : the incredible tale of ""the unsinkable"" Moshe Wallas","Ohayon, Avraham;Bar-Lev, Dan;Bar-Lev, Yoel;David, Brocha",2017,Feldheim Publishers,"Jerusalem, Israel;Nanuet, NY",,,,,,color illustrations,93 pages,31 cm,,,,,"Translation of: Titanik : sipurah shel ha-Titanik, ha-sefinah ha-Ê¼agadit, ha-sefinah ha-vilti pegiah ha-shazur be-sipur hayav shel Mosheh, ha-naar ha-khafri she-alah le-gedulah, hitasher ve-akar al ha-ir ha-gedolah, hafakh le-gevir, avad et kol hono ve-shav le-khur mahtsavto al sipunah shel ha-Titanik.",,,,"This is the story of the Titanic, the legendary ship that could never sink, interlaced with the tale of Moshe, a poor village boy who moves to the big city and gets swept up by his dizzying financial success. Moshe's life is on a trajectory to fame and fortune until everything falls apart and his grandiose dreams vanish into oblivion, like the swiftly sinking Titanic. But then his life takes a turn in a most unexpected way. This graphic novel combines the story of the Titanic with Moshe and the lessons he learns that change his life.-- Back cover.",Translations;Shipwrecks;Repentance;Judaism;Avarice;Jewish religious fiction;Haredi and religious literature;Historical fiction;Graphic novels;Fiction,Image;StillImage,image/jpeg,eng,item
hk1289,placeholder.jpg,"Titanic 2 : the secret is revealed : the amazing interwoven backstory of ""the unsinkable"" Wallas family","Ohayon, Avraham;Bar-Lev, Yoel;Bar-Lev, Dan",2018,Feldheim Publishers,"Jerusalem, Israel;Nanuet, NY",,,,,,color illustrations,91 pages,31 cm,,,,,,,,,"Here, in Titanic 2, the intricate weave of the strands of astonishing hashgachah pratis reveals the full story of Moshe's past - of a family flung apart in tragedy, yet attached in unforeseen ways, overcoming adversity and impossible odds to become leaders in avodas Hashem. Read on and discover the secret of the amazing interwoven backstory of the ""unsinkable"" Wallas family! -- Back cover.",Translations;Shipwrecks;Jewish families;Russia;Jewish religious fiction;Religious comics;Action and adventure;Graphic novels;Fiction,Image;StillImage,image/jpeg,eng,item
hk1290,placeholder.jpg,"Titanic 3 : a formula for danger : the ""unsinkable"" Moshe Wallas and his ripple effect throughout history","Ohayon, Avraham;Bar-Lev, Dan;Bar-Lev, Yoel",2020,Feldheim Publishers,"Jerusalem, Israel;Nanuet, NY",,,,,,color illustrations,89 pages,31 cm,,,,,,,,,"TITANIC 3 is the third volume in the series that weaves together the story of the Titanic, the legendary unsinkable ship, with the tale of Moshe, a poor village boy who moves to the big city and gets swept up by his dizzying financial success. In this volume you'll read about the Russian Secret Police's search for a valuable test tube that appears to have been lost at sea along with the Titanic, and about the lawsuit that one Mr. Ellis Rhodes serves against Rav Moshe Wallas's yeshivah. Does the secret test tube in Moshe's possession hold the key to keeping everything afloat?",Translations;Jewish families;Russia;Religious comics;Historical fiction;Graphic novels;Fiction,Image;StillImage,image/jpeg,eng,item
hk1291,placeholder.jpg,Meir Lamberski's See for yourself : an exciting challenge for the whole family that will let you see life as you've never seen it before!,"Lamberski, Meir;Chanan, Yaakov",2021,Feldheim Publishers,"Jerusalem, Israel;Nanuet, NY",,,,,,color illustrations,65 pages,35 cm,,,,,"""Originally published in Hebrew as Umka D'liba.""",,,,,Jewish ethics;Customs and practices;Conduct of life;Jewish way of life;Jewish religious education,Image;StillImage,image/jpeg,eng,item
hk1292,placeholder.jpg,"Titanic 5 : to right a wrong : the ""unsinkable"" Moshe Wallas rides the waves to the Holy Land","Ohayon, Avraham;Bar-Lev, Dan;Bar-Lev, Yoel;David, Brocha",2022,Feldheim Publishers,"Jerusalem, Israel;Nanuet, NY",,,,,,color illustrations,98 pages,31 cm,,,,,,,,,,Translations;Rabbis;Religious comics;Historical fiction;Graphic novels;Fiction,Image;StillImage,image/jpeg,eng,item
hk1293,placeholder.jpg,Just like-- me!,"Steinberg, Bracha;Perel, Lisa",2001,Feldheim Publishers,"Jerusalem, Israel;Nanuet, NY",,,,,,illustrations,32 pages,24 cm,,,,,,,,,"Rivka tries to be like other girls, but ends up being just herself.",Identity;Jewish girls;Fiction,Image;StillImage,image/jpeg,eng,item
hk1294,placeholder.jpg,Shikufitzky,"Glik, Shifrah",2002,Feldheim Publishers,"Jerusalem, Israel;Nanuet, NY",,,,,,chiefly color illustrations,volumes,23 cm,,,,,,,,,"A lovable Orthodox Jewish family whose hilarious exploits point up common weaknesses of character. The children include: Yiska, a bossy and chatty older sister; Temima, an insecure 7-year old girl; Kehos, a mischievous younger brother, and a thoughtful baby, Klonimus.",Humor;Families;Israeli wit and humor;Pictorial works;Israel;Graphic novels,Image;StillImage,image/jpeg,eng,item
hk1295,placeholder.jpg,Shikufitzky,"Glik, Shifrah",2002,Feldheim Publishers,"Jerusalem, Israel;Nanuet, NY",,,,,,chiefly color illustrations,100 pages,23 cm,,,,,,,,,"A lovable Orthodox Jewish family whose hilarious exploits point up common weaknesses of character. The children include: Yiska, a bossy and chatty older sister; Temima, an insecure 7-year old girl; Kehos, a mischievous younger brother, and a thoughtful baby, Klonimus.",Humor;Families;Israeli wit and humor;Pictorial works;Israel;Graphic novels,Image;StillImage,image/jpeg,eng,item
hk1296,placeholder.jpg,I wish I were a king,"Krohn, Genendel;Peleg, Tirtsah",2003,Feldheim Publishers,"Jerusalem, Israel;Nanuet, NY",,,,,,color illustrations,49 pages,28 cm,,,,,"""A retelling of an old legend, cited in Generation to generation : recollections of a Chassidic legacy / Abraham J. Twerski""--Title page verso",,,,A stonecutter wants to be everything he is not and has to learn the hard way that what he really wants to be is exactly who he is.,Identity;Contentment;Fiction,Image;StillImage,image/jpeg,eng,item
hk1297,placeholder.jpg,Straight from the lion's mouth and other stories,"Peleg, Tirtsah;Weinbach, Sheindel;Ben-Simon, Aviad",2006,Feldheim Publishers,"Jerusalem, Israel;Nanuet, NY",,,,,,color illustrations,54 pages,28 cm,,,,,,"K'chu l'mashal (Feldheim Publishers, 2005)",Includes bibliographical references.,"How strong do you think you are? -- Straight from the lion's mouth -- This is our life -- Use your head -- Thinking big -- The fox and the wolf -- Hey, why are you sleeping? -- Our own enemy -- The golden cage.",,Jewish parables;Fables,Image;StillImage,image/jpeg,eng,item
hk1298,placeholder.jpg,The pink dollhouse,"Herzog, Pearl;Bodel, Itai",2008,Feldheim Publishers,"Jerusalem, Israel;Nanuet, NY",,,,,,color illustrations,112 pages,25 x 29 cm,,,,,Translation of: Bet ha-bubot ha-verudot : temunot ve-sipurim li-yeladot vi-yeladim.,,,,"Four dolls--Debra, Molly, Nina, and Rena--who live inside a house that is all pink have adventures and learn about friendship, emotions, and colors.",Dolls;Dollhouses;Stories in rhyme;Fiction,Image;StillImage,image/jpeg,eng,item
hk1299,placeholder.jpg,Who am I?,"Schon, Ruchy;Roth, Ruchela",2008,Feldheim Publishers,"Jerusalem, Israel;Nanuet, NY",,,,,,color illustrations,27 pages,24 cm,,,,,,,,,"Introduce your child to the people in his world. Meet Refael the doctor, Betzalel the builder, Chaya the farmer, and many of their friends. Teach your child about a variety of professions and their associated mitzvos!",Occupations;Professions;Yiddish language;Terms and phrases;Fiction;Poetry;Stories in rhyme,Image;StillImage,image/jpeg,eng,item
hk1300,placeholder.jpg,Shikufitzky 5,"Glik, Shifrah",2009,Feldheim Publishers,"Jerusalem, Israel;Nanuet, NY",,,,,,chiefly color illustrations,97 pages,23 cm,,,,,,,,,"A lovable Orthodox Jewish family whose hilarious exploits point up common weaknesses of character. The children include: Yiska, a bossy and chatty older sister; Temima, an insecure 7-year old girl; Kehos, a mischievous younger brother, and a thoughtful baby, Klonimus.",Humor;Families;Israeli wit and humor;Pictorial works;Israel;Wit and humor;Graphic novels,Image;StillImage,image/jpeg,eng,item
hk1301,placeholder.jpg,The cherry on top : a kosher junior cookbook,"Grossman, Chaya Feigy;Schon, Ruchy",2009,Feldheim Publishers,"Jerusalem, Israel;Nanuet, NY",,,,,,color illustrations,79 pages,25 cm,,,,,,,,,,Jewish cooking;Cookbooks,Image;StillImage,image/jpeg,eng,item
hk1302,placeholder.jpg,Our heroes : kids follow in the footsteps of the past,"Walder, Chaim;Gershtein, Yonathan",1998,Feldheim Publishers,"Jerusalem, Israel;Nanuet, NY",,,,,,illustrations,200 pages,25 cm,,,,,,,,The suspects -- Who stole the coin? -- Memory game -- Angels in the night -- Flat tire -- The life jacket -- Be my friend -- Restored to life -- Nothing to be ashamed of! -- Secret weapon -- No harm will befall you.,,Jewish religious fiction;Heroes,Image;StillImage,image/jpeg,eng,item
hk1303,placeholder.jpg,The secret of the red pearl,"Sternfeld, Nathan;Bikhman, David",2005,Feldheim Publishers,"Jerusalem, Israel;New York",,,,,,illustrations,229 pages,25 cm,Rebbe Mendel,,,,Translation of: Rak sheloshah hadashim.,,,,A novel in which the reader will discover: how a mysterious red pearl finds its way to Haifa maritime museum; why a German escape artist bears an uncanny resemblance to the museum's director--and to his twin brother in America; what's the connection between twenty elephants and the doubled word at the end of Parashas Vayeishev.-p. [4] of cover.,Translations;Rabbis;Jewish way of life;Burglars;Haifa (Israel);Israel;Fiction,Image;StillImage,image/jpeg,eng,item
hk1304,placeholder.jpg,Wordwatch : a Shemiras halashon lesson-a-day for teens,"Golden, Aliza;Margolis, Sari",2012,Feldheim Publishers,"Jerusalem, Israel;New York",,,,,,,170 pages,24 cm,,,,,,,,,,Gossip;Libel and slander;Judaism;Jewish ethics,Image;StillImage,image/jpeg,eng,item
hk1305,placeholder.jpg,Mihu the detective and the mystery of the blue budgie,"Halpern, Chaiky",1987,Feldheim Publishers,"Jerusalem, Israel;New York",,,,,,color illustrations,24 pages,24 cm,Sifrei Rimon,,,,,,,,,"Budgerigar;Doyle, Arthur Conan, 1859-1930",Image;StillImage,image/jpeg,eng,item
hk1306,placeholder.jpg,Who knows one? : a book of Jewish numbers,"Ganz, Yaffa",1981,Feldheim Publishers,"Jerusalem, Israel;New York",,,,,,color illustrations,1 volume,28 cm,,,,,,,,,,Judaism;Hebrew language;Numerals;Fasts and feasts,Image;StillImage,image/jpeg,eng,item
hk1307,placeholder.jpg,Hindy the hen,"Grunfeld, C L;Gurwicz-Ziskind, A",1994,Feldheim Publishers,"Jerusalem, Israel;Spring Valley, NY",,,,,,color illustrations,31 pages,25 cm,,,,,,,,,The story of a farmer and his family and their favorite hen called Hindy.,Chickens;Jewish themes in children's literature,Image;StillImage,image/jpeg,eng,item
hk1308,placeholder.jpg,Spunky the monkey learns not to be grumpy,"Pollack, Yehudis;Edelstein, Racheli",2014,Feldheim Publishers,"Jerusalem, Israel;Nanuet, NY",,,,,,color illustrations,28 pages,25 cm,Know & Grow,,,,"Includes social skills tips by experts, D. Samet, M.S. and D.E. Levovits, M.S.",,,,"""Spunky the monkey had a real cheerful streak, but when Spunky was grumpy things were bleaker than bleak! ... First in the Know & Grow series, this book empowers kids ot deal with disappointment and bad moods in a positive way."" -- back cover.",Emotions;Social skills;Monkeys;Conduct of life;Picture books;Jewish religious fiction;Haredi and religious literature;Fiction,Image;StillImage,image/jpeg,eng,item
hk1309,placeholder.jpg,Larger than life!,"Walder, Chaim",2020,Feldheim Publishers,"Jerusalem, Israel",,,,,,illustrations,62 pages,,,,,,,,,,,Jewish ethics;Jewish way of life;Heroes;Jewish religious education;Fiction;Graphic novels,Image;StillImage,image/jpeg,eng,item
hk1310,placeholder.jpg,In the footsteps of our fathers : gedolei Yisrael live the lessons of Pirke Avos,"Ohayon, Avraham;Hen, Avishai",2015,Dani Sefarim,"Kiryat Gat, Israel",,,Feldheim Publishers,"Jerusalem, Israel ; Nanuet, NY",,color illustrations,58 pages,33 cm,,,,,Illustrations by A. Chen.,,,,,Rabbis;Jewish exempla;Legends;Jewish legends;Tannaim;Haredi and religious literature,Image;StillImage,image/jpeg,eng,item
hk1311,placeholder.jpg,The Big book of questions & answers : fascinating facts for the curious mind,"Kenan, M;Golan-Martin, Orit",2006,Dani Sefarim,"Kiryat Gat, Israel",,,Feldheim Publishers,"Nanuet, NY",,color illustrations,87 pages,33 cm,,,,,,,,,,Encyclopedias and dictionaries;Translations,Image;StillImage,image/jpeg,eng,item
hk1312,placeholder.jpg,Operation Thunderbolt,"Gruner, Levi Yitshak;Brill, Yisrael;Hanan, Yaakov;Gordon, Daniyel ha-Sofer mi-Kefar Habad",2022,Malkhut Haketer,"Kiryat Malachi, Israel",,,,,,color illustrations,47 pages,32 cm,,,,,,,,,,"Entebbe Airport Raid, 1976;Habad;Religious comics;Historical fiction;Graphic novels;Schneerson, Menachem Mendel, 1902-1994;Netanyahu, Yonatan, 1946-1976",Image;StillImage,image/jpeg,eng,item
hk1313,placeholder.jpg,The Katz [=Hagadah shel Pesah] Passover Haggadah : the Art of faith and redemption,"Chait, Baruch;Pollack, Gadi;Markovich, Evgeny;Gasner, Ben;Neugroschel, Mordechai",2003,B & B Septimus Educational Publications,"Kiryat Sefer, Israel",Ma'arava Machon Rubin Publications,"Lawrence, NY",Feldheim Publishers,"Jerusalem, Israel ; Nanuet, NY",The Lobos edition,color illustrations,120 pages,29 cm,Halamdan hakatan,,,,"English and Hebrew;introductory material, commentary and instructions in English only.;500 Includes The Exodus from Egypt: fact or myth? by Mordechai Neugroschel, p. 116-120.;Accompanied by The Seder guide (16 p.;24 cm.).;Includes an insert with a correction on page 92.",,,"Preface: from the Torah insights of harav Reuven Katz -- The art of faith and redemption / Rabbi Baruch Chait -- Introduction / Rabbi Mordechai Neugroschel -- Haggadah: Hebrew text, English translation, dramatic artwork -- Source material: sources for artwork and explanations -- The exodus from Egypt: fact or myth? / Rabbi Mordechai Neugroschel -- The seder guide, Supplement.",,Haggadot;Commentaries;Seder;Liturgy;Judaism;Aggada;Illustrated works;Liturgical texts,Image;StillImage,image/jpeg,eng,item
hk1314,placeholder.jpg,MiddosMan : learning to share,"Ornstein, Esther;Judowitz, Yoel Hillel",2013,Israel Bookshop Publications,"Lakewood, NJ",,,,,,color illustrations,33 pages,28 cm + 1 audio disc,MiddosMan,1,,,Includes a CD with narrated MiddosMan story with music and song.,,,,,Sharing;Jewish ethics;Orthodox Judaism;Picture books;Audiobooks;Fiction,Image;StillImage,image/jpeg,eng,item
hk1315,placeholder.jpg,MiddosMan : being a nice friend,"Ornstein, Esther;Judowitz, Yoel Hillel;Kapnick, Hillel;Naftel, Baruch;Ganz, Raphael Rachamim;Friedland, Miri;Rosenblum, Moshe",2014,Israel Bookshop Publications,"Lakewood, NJ",,,,,,color illustrations,31 pages,28 cm + 1 audio disc,MiddosMan,2,,,"Includes a CD with narrated MiddosMan story with music and song.;audio book voices Baruch Naftel, Raphael Rachamim Ganz, Miri Friedland, Moshe Rosenblum.",,,,,Jewish ethics;Orthodox Judaism;Picture books;Audiobooks;Fiction,Image;StillImage,image/jpeg,eng,item
hk1316,placeholder.jpg,MiddosMan : being happy for others,"Ornstein, Esther;Judowitz, Yoel Hillel",2015,Israel Bookshop Publications,"Lakewood, NJ",,,,,,color illustrations,33 pages,28 cm + 1 audio disc,MiddosMan,3,,,Audio book engineered and narrated by Hillel Kapnick.,,,,,Jewish ethics;Orthodox Judaism;Audiobooks;Fiction,Image;StillImage,image/jpeg,eng,item
hk1317,placeholder.jpg,Life support : stories of chaplaincy and bikur cholim rounds,"Stein, Rachel (Hospital chaplain)",2016,Israel Bookshop Publications,"Lakewood, NJ",,,,,,,213 pages,24 cm,,,,,,,,,,Visiting the sick (Judaism);Chaplains;Hospital;Jewish ethics;Anecdotes,Image;StillImage,image/jpeg,eng,item
hk1318,placeholder.jpg,MiddosMan : different doesn't matter,"Ornstein, Esther;Judowitz, Yoel Hillel;Kapnick, Hillel;Kapnick, Gila;Mandel, Zahava;Naftel, Baruch;Eichler, Shlomo;Ornstein, Shua;Broyde, Nati",2017,Israel Bookshop Publications,"Lakewood, NJ",,,,,,color illustrations,33 pages,28 cm + 1 audio disc,MiddosMan,4,,,"Includes a CD with narrated MiddosMan story with music and song.;engineered and narrated by Hillel Kapnick;audio book voices Shlomo Eichler, Zahava Mandel, Gila Kapnick, Baruch Naftel, Shua Ornstein, Nati Broyde.",,,,,Jewish ethics;Orthodox Judaism;Fiction,Image;StillImage,image/jpeg,eng,item
hk1319,placeholder.jpg,When I am a mommy,"Schiffman, Dishy;Engel, Rivka",2017,Israel Bookshop Publications,"Lakewood, NJ",,,,,,color illustrations,22 pages,29 cm,,,,,,,,,"Kayla says that when she is a Mommy she will not punish her children, make them go to school, eat healthy food, or brush their teeth, but Mommy helps her see the consequences of what she is asking Kayla to do.",Parenting;Mother and child;Discipline of children;Children;Conduct of life;Picture books;Jewish religious fiction;Haredi and religious literature;Fiction,Image;StillImage,image/jpeg,eng,item
hk1320,placeholder.jpg,When I am a abba,"Schiffman, Dishy;Engel, Rivka",2018,Israel Bookshop Publications,"Lakewood, NJ",,,,,,color illustrations,22 pages,29 cm,,,,,,,,,,Parenting;Father and child;Discipline of children;Jewish religious fiction;Picture books;Fiction,Image;StillImage,image/jpeg,eng,item
hk1321,placeholder.jpg,MiddosMan : perfecting my patience,"Ornstein, Esther;Judowitz, Yoel Hillel;Kapnick, Hillel",2020,Israel Bookshop Publications,"Lakewood, NJ",,,,,,color illustrations,33 pages,28 cm + 1 audio disc,MiddosMan,6,,,Includes a CD with narrated MiddosMan story with music and song.,,,,,Patience;Judaism;Jewish ethics;Fiction,Image;StillImage,image/jpeg,eng,item
hk1322,placeholder.jpg,MiddosMalka : shalom in our homes,"Ornstein, Esther;David, Racheli;Kapnick, Hillel",2021,Israel Bookshop Publications,"Lakewood, NJ",,,,,,color illustrations,33 pages,28 cm + 1 audio disc,MiddosMalka,2,,,"Includes a CD with narrated MiddosMalka story with music and song ...;engineered and narrated by Hillel Kapnick;audio book voices Hillel Kapnick, Temimah Gilden, Gila Kapnick, Frieda Ornstein, Shua Ornstein.",,,,,Conduct of life;Jewish families;Jewish ethics;Audiobooks;Fiction,Image;StillImage,image/jpeg,eng,item
hk1323,placeholder.jpg,MiddosMan : acting with derech eretz,"Ornstein, Esther;David, Racheli;Kapnick, Hillel",2022,Israel Bookshop Publications,"Lakewood, NJ",,,,,,color illustrations,33 pages,28 cm + 1 audio disc,MiddosMan,7,,,Includes code for MP3 download.,,,,,Jewish ethics;Orthodox Judaism;Picture books;Audiobooks;Fiction,Image;StillImage,image/jpeg,eng,item
