keyid,filename,title,creator,date,publisher not identified,publisherloc,publisher2,publisher2loc,distributor,distloc,edition,illustration,pages,size,series,volume,seriesadd,volumeadd,note,translatedfrom,bibliography,contents,summary,subjects,type,format,language,display_template
hk0843,placeholder.jpg,Four seasons with Madame Chamberlaine,"Wolner, Tzipie",2022,Menucha Publishers,"Brooklyn, NY",,,,,,illustrations,141 pages,24 cm,,,,,,,,,"""Madame Chamberlaine is always in season! Runaway bird invading the classroom? Got only half a haircut at the hairdresser? Lost in a massive corn maze? D'accord, mes chÃ©ries...Madame Chamberlaine -- with her pink-tasseled scarves, tinkly laugh, and mouthwatering homemade desserts -- joins sisters Shprintzi and Shuly on one hilarious adventure after another. Follow along as they drive a blaring fire truck on a rescue mission, fly into the sky on a giant trampoline, investigate a creepy crime in snowy Montreal, and more. Once again, popular author Tzipie Wolner has crafted a collection of upbeat, action-packed escapades that are sure to brighten your day. Four Seasons with Madame Chamberlaine is the fourth book in the wildly popular Madame Chamberlaine series -- magnifique!"" -- Publisher's website.",French language;Study and teaching;United States;Haredi and religious literature;Fiction;Religious fiction,Image;StillImage,image/jpeg,eng,item
hk0844,placeholder.jpg,It's Wednesday again : a novel,"Saks, Adina",2022,Menucha Publishers,"Brooklyn, NY",,,,,,,140 pages,24 cm,,,,,,,,,,Jewish teenagers;United States;Jewish families;Accident victims;Teenage girls;Traffic accidents;Guilt;Haredi and religious literature;Fiction;Religious fiction,Image;StillImage,image/jpeg,eng,item
hk0845,placeholder.jpg,The fortieth stone,"Eller, Andrea Ramon",2022,Menucha Publishers,"Brooklyn, NY",,,,,,,93 pages,22 cm,,,,,,,,,,Jewish legends,Image;StillImage,image/jpeg,eng,item
hk0846,placeholder.jpg,You're joking... again! : more great kosher jokes,"EhrlichKlein, Tzvia",2022,Menucha Publishers,"Brooklyn, NY",,,,,,,110 pages,22 cm,,,,,"""Over 650 jokes, riddles & fascinating facts!""-- Cover.",,,,,Jewish wit and humor;Wit and humor;United States,Image;StillImage,image/jpeg,eng,item
hk0847,schreiber_makinghermark.jpg,Making her mark,"Schreiber, Perel;Dombey, Miriam",2023,Menucha Publishers,"Brooklyn, NY",,,,,,,182 pages,22 cm,BY High,2,,,,,,,,Jewish girls;Jewish day schools;United States;Fiction,Image;StillImage,image/jpeg,eng,item
hk0848,gross_goldengatenew.jpg,The Golden Gate,"Gross, Sukey",2023,Menucha Publishers,"Brooklyn, NY",,,,,,illustrations,164 pages,24 cm,Girls of Rivkah Gross Academy,,,,,,,,"""California, here we come! On their way home from school one day, Bracha and Sara realize that they're being followed. Of course, the irrepressible duo loves mysteries, but this one leaves them perplexed. Why would someone be trailing them through the streets of quiet Pineville? The intrigue heats up after Bracha and Sara are offered tickets to San Francisco to attend a family bar mitzvah. Is their mystery stalker going to follow them all the way to California? Join Bracha, Sara, and Cousin Shoshi as they tour the hills and sites of San Francisco, encounter Chinese gangs, and learn some intriguing family history in this captivating adventure, the third in the Rivkah Gross Academy series, now back in print!"" -- Publisher's website.",Jewish girls;California;San Francisco (California);Detective and mystery;Fiction;Haredi and religious literature,Image;StillImage,image/jpeg,eng,item
hk0849,placeholder.jpg,It takes a village : an eye-opening and entertaining visit to Middos village,"Lamberski, Meir;Amchi, Osnat",2023,Menucha Publishers,"Brooklyn, NY",,,,,,illustrations,56 pages,30 cm,,,,,,,,,,Jewish ethics;Graphic novels;Haredi and religious literature,Image;StillImage,image/jpeg,eng,item
hk0850,placeholder.jpg,Let's draw! : a step-by-step cartoon tutorial for kids,"Ohayon, Avraham;Hen, Avishai",2023,Menucha Publishers,"Brooklyn, NY",,,,,,color illustrations,53 pages,31 cm,,,,,,,,,,Cartooning technique;Drawing,Image;StillImage,image/jpeg,eng,item
hk0851,rosen_frommetoyou.jpg,From me to you : kids share their true stories,"Rosen, Chaya",2023-2024,Menucha Publishers,"Brooklyn, NY",,,,,,,volumes,22 cm,,,,,,,,,,Conduct of life;Anecdotes,Image;StillImage,image/jpeg,eng,item
hk0852,roteman_songoffaith.jpg,Song of faith : a teen novel,"Roteman, Ellen",2024,Menucha Publishers,"Brooklyn, NY",,,,,,,220 pages,24 cm,,,,,,,,,,"Jewish girls;Jewish teenagers;Holocaust, Jewish (1939-1945)",Image;StillImage,image/jpeg,eng,item
hk0853,placeholder.jpg,Good as gold,"Millman, M C",2019,Menucha Publishers,"Brooklyn, NY",,,,,,,92 pages,22 cm,,,,,,,,,,Pony express;Frontier and pioneer life;West United States;Horsemen and horsewomen;United States;Fiction,Image;StillImage,image/jpeg,eng,item
hk0854,placeholder.jpg,Laibel's libel,"Millman, M C",2022,Menucha Publishers,"Brooklyn, NY",,,,,,,157 pages,22 cm,,,,,,,,,,Blood accusation;Europe;19th century;Fiction,Image;StillImage,image/jpeg,eng,item
hk0855,placeholder.jpg,Lockdown : a novel,"Pearlman, Ruthie",2014,Menucha Publishers,"Brooklyn, NY",,,,,,,288 pages,24 cm,,,,,Sequel to: Pearlman Ruthie School of secrets;Sequel: Pearlman Ruthie Disappeared,,,,"""MP Simon Dean and his wife, Antonia, are visiting Ner Miriam Seminary, whose staff and students are eager to honor and impress the famous couple. But due to a shocking turn of events, the unassuming school on the rocky crags of England's south coast becomes a crime scene. There's no going in or out - it's on lockdown. Meanwhile, fearless supersleuth Yael Reed is on a mission for closure and clarity as she bravely sets out to meet her biological mother. Will she be welcomed with open arms, or regret her decision to revisit that chapter of her troubled past? In Lockdown, talented author Ruthie Pearlman reacquaints readers with the unforgettable cast of characters first introduced in the wildly popular School of Secrets. This long-awaited sequel will keep you so locked into the thrill of the read that you won't want it to end.""-- Page 4 of cover",Jewish girls;England;London (England);Jewish religious schools;Detective and mystery;Fiction;Haredi and religious literature,Image;StillImage,image/jpeg,eng,item
hk0856,placeholder.jpg,Ghosthunters!,"Siegel, Malky;Zakon, Miriam Stark",2017,Menucha Publishers,"Brooklyn, NY",,,,,,,138 pages,21 cm,Baker's dozen,2,,,,,,,"""Once there was a family. Their name was Baker. They had many children. Twelve of them. The Baker's Dozen. The move to the spacious old Wharton Mansion seems like a dream come true. But the dream quickly turns into a nightmare. On the very first night eerie noises wake Tikva. She soon stumbles on an intruder right in their own basement! But her family doesn't believe a word of her story ... or understand a series of other puzzling incidents. Could the old house actually be haunted? A wild baseball shatters a window, bringing Chezky face-to-face with Grouchy Mr. Schwartz and his terrifying dog. To pay for the damage, Chezky faces a long term of hard labor. In desperation, he hits upon a different way to raise money, one that leads him and his sisters into more trouble and more danger than any of them could have foreseen.""--Amazon.com",Jewish way of life;Haunted houses;Haredi and religious literature;Fiction;Religious fiction,Image;StillImage,image/jpeg,eng,item
hk0857,placeholder.jpg,Stars in their eyes,"Stein, Aidel;Zakon, Miriam Stark",2018,Menucha Publishers,"Brooklyn, NY",,,,,,,146 pages,22 cm,Baker's dozen,4,,,,,,,"Trying to get tickets to pre-Purim concert, the quints launch a campaign without considering its consequences.",Siblings;Jewish way of life;Fiction,Image;StillImage,image/jpeg,eng,item
hk0858,placeholder.jpg,Yanky's amazing discovery,"Bauman, Reuven",2018,Menucha Publishers,"Brooklyn, NY",,,,,,illustrations;portraits,77 pages,21 cm,,,,,,,,,"Young Yanky Rosen, who is having a hard time concentrating and studying the Gemara in yeshiva, discovers a folder in the attic, with the story of the life of Rabbi Yaakov Kamenetsky. Rabbi Kamenetsky's story and teachings inspire Yanky to become a better learner, and a better person.","Jewish religious education;Talmud Torah;Perseverance;Jewish ethics;Attention-deficit hyperactivity disorder;Learning disabilities;Fiction;Kamenetzky, Jacob, 1891-1986",Image;StillImage,image/jpeg,eng,item
hk0859,placeholder.jpg,Shani's scoop,"Klein, Leah",2019,Menucha Publishers,"Brooklyn, NY",,,,,,illustrations,138 pages,21 cm,BY Times,1,,,"Originally published: Southfield, Michigan : Targum Press, 1991.",,,,"""What do you do if you're beginning eighth grade and things seem ... well, boring? What if you want something new to tackle, an unusual project, an exciting challenge? If you're Shani Baum--lively, talented, and, above all, efficient-- you come up with a super idea: you start a school newspaper! At first, things couldn't be better. Everyone loves the idea, and Shani even gets her own newsroom! But then Raizy Segal--shy, quiet Raizy, whom nobody really knows--is appointed assistant editor. And to make things worse, Raizy claims that Shani's very first scoop shouldn't even be allowed in her own paper! But the editor is always right or is she?""--Page 4 of cover",Jewish girls;Student newspapers and periodicals;School journalism;Jewish way of life;Fiction,Image;StillImage,image/jpeg,eng,item
hk0860,placeholder.jpg,Escape from the USSR : a Russian refusenik's story of survival,"Safran, Nesanel Yoel",2019,Menucha Publishers,"Brooklyn, NY",,,,,,illustrations;maps,117 pages,22 cm,Escape series,,,,Maps on endpapers.,,Includes bibliographical references (page 117),,"""The USSR is a dangerous place to be openly Jewish. Zev and Carmela Raiz want to leave so they can live full Jewish lives somewhere else. But to leave, they need permission from the government. And the government refuses to let them go. The Raizes become refuseniks. They are followed everywhere they go. Their telephones are tapped. They live under the threat of being sent to Siberia. This is the true story of a brave and determined family. Join them as they continue to live Jewish lives despite the risks they face. Readers will experience the life and perils of being a refusenik. They will learn about the political forces that finally give the Raiz family the chance to escape from the USSR. The Escape series provides readers with compelling true narratives of Jewish heroism and survival.""--Page 4 of cover",Soviet Union;Jewish families;Refuseniks;Persecutions;Jewish refugees;Biography,Image;StillImage,image/jpeg,eng,item
hk0861,placeholder.jpg,"Ima, come home","Stein, Aidel;Zakon, Miriam Stark",2019,Menucha Publishers,"Brooklyn, NY",,,,,,,147 pages,22 cm,Baker's dozen,7,,,Originally published 1993.,,,,,Jewish way of life;Siblings;United States;Fiction,Image;StillImage,image/jpeg,eng,item
hk0862,placeholder.jpg,Through thick and thin,"Garfunkel, Debby;Zakon, Miriam Stark",2019,Menucha Publishers,"Brooklyn, NY",,,,,,,143 pages,22 cm,Baker's dozen,9,,,,,,,"""Moishy Baker knows a secret: his father is going bankrupt--or so Moishy thinks. The Baker kids are determined to save the day by earning lots and lots of money. Moishy and Chezky take on the neighbors' chores, while the quints open a health spa in their basement. They think it's a fantastic way to make money. Unfortunately, their mother doesn't quite see eye to eye with them ... Meanwhile, Tikva has problems of her own. Her whole class is stargazing the nights away, preparing for the citywide astronomy contest, while she doesn't even know what a star looks like. Being nearblind, she feels lonely and left out. Finally, Tikva discovers something surprising about herself--and all the Baker kids discover something very surprising about their father--in this rollicking read about everyone's favorite family. Whatever happens, you can be certain of one thing: Those Bakers stick together--Through Thick and Thin!""--Amazon.com",Siblings;Jewish way of life;Fiction,Image;StillImage,image/jpeg,eng,item
hk0863,placeholder.jpg,Escape from Hurricane Katrina : a Jewish family's story of survival,"Ben Shachar, Chaya Sara",2019,Menucha Publishers,"Brooklyn, NY",,,,,,illustrations;maps,114 pages,22 cm,Escape series,,,,Maps on endpapers.,,,,"""The city of New Orleans is in danger. A huge hurricane is on its way. The Rivkin family must decide whether to flee the city or to stay home. If they leave, will they be able to get out in time? Or will they be stuck in their car when the hurricane strikes? And what about all the people who are counting on their help? This is the true story of a brave and compassionate family. Join them as they witness one of the worst hurricanes in U.S. history. Readers will be excited by this account of the day-to-day life of a Jewish family as it escapes from the aftermath of Hurricane Katrina. The Escape series provides readers with compelling true narratives of Jewish heroism and survival.""--Page 4 of cover","Jewish families;Louisiana;New Orleans (Louisiana);Hurricane Katrina, 2005;Disaster relief;Floods;Biography;Rivkind family",Image;StillImage,image/jpeg,eng,item
hk0864,gross_secrets.jpg,Secrets,"Gross, Sukey",2019,Menucha Publishers,"Brooklyn, NY",,,,,,,227 pages,24 cm,,,,,,,,,"""Faigy stopped writing, and put her head down, teary-eyed. ""That's the problem, Esti,"" she said. ""We're leaving civilization to go to a midbar!"" ""But Bubby and Zeidy and Mama and Papa wouldn't lead us into a place of danger,"" I whispered. When Esti Fisher's grandmother receives a mysterious letter, the curious eleven-year-old wonders about the secret it contains. Why is her close-knit family suddenly packing up and leaving the busy streets and towering skyscrapers of New York City, and moving to Fords, Kansas, with its Underground Railroad tunnels and dark, deserted house? Are Esti and her family the only Jews in far-off Fords? How will their Yiddishkeit survive? Secrets is a colorful, heartwarming adventure by popular author Sukey Gross. In this exciting historical tale, she takes readers on a fascinating journey through American life in the 1920s-from the hustle and bustle of the Upper East Side to the slow-paced, stark frontiers of the Midwest. Join Esti as she discovers one incredible secret after another-leading to the one that changes her life forever.""--Page 4 of cover",Jewish families;Moving household;Life change events;Orthodox Jews;Fords (Kansas);Kansas;New York State;United States;History;1919-1933;Fiction;Historical fiction;Haredi and religious literature,Image;StillImage,image/jpeg,eng,item
hk0865,placeholder.jpg,Spring fever,"Klein, Leah",2019,Menucha Publishers,"Brooklyn, NY",,,,,,,135 pages,22 cm,BY Times,5,,,First published 1992.,,,,"""The B.Y. Times Raizy is not the only one of the B.Y. Times' staffers who is unhappy. Red-haired, impetuous Nechama Orenstein takes a close look at herself and doesn't really like what she sees--the star athlete and class clown, the kid no one takes seriously. ""Spring fever"" hits Bais Yaakov of Bloomfield as Raizy and Nechama decide to change their image. Raizy takes off her glasses and her ponytail, and Nechama sticks her head in a book and, worst of all, quits the machanayim team just days before the big game! There are plenty of laughs--and lessons--in store as the B.Y. Times girls sort themselves out and, finally, recover from their Spring Fever.""--Back cover.",Jewish girls;Jewish way of life;Friendship;Fiction,Image;StillImage,image/jpeg,eng,item
hk0866,placeholder.jpg,The new kids,"Klein, Leah",2020,Menucha Publishers,"Brooklyn, NY",,,,,,illustrations,142 pages,21 cm,BY Times,10,,,,,,,"""To editor-in-chief Chani Kaufman's dismay, her new assistant is so anxious to make a good impression that she quickly earns the title of Miss Show-Off! What's an editor to do? Meanwhile, Batya is saying her own ""hello"" to sad-eyed Davey, a little boy who will be living with the Ben-Levis for a few months while his mother is in the hospital. Batya dreams of all the fun she'll have with her new ""little brother""...only Davey just won't cooperate... Working together, our favorite newspaper girls find just the right way to welcome each of The New Kids. Join them and say...""hello!""""--Back cover.",Jewish girls;Student newspapers and periodicals;School journalism;Jewish way of life;United States;Fiction,Image;StillImage,image/jpeg,eng,item
hk0867,placeholder.jpg,The Baker family circus,"Rose, Miriam;Zakon, Miriam Stark",2020,Menucha Publishers,"Brooklyn, NY",,,,,,,173 pages,21 cm,Baker's dozen,12,,,"""Super special""--Cover",,,,"""A bas mitzvah is a joyous event. So a quintuple bas mitzvah should be five times as happy, right? Then why are the Bakers so miserable? For one thing, the quints are divided over what kind of party to have. For another, Ashi is in trouble at yeshivah, and no one knows why. But the biggest reason is Tikva. She may be losing the most precious thing of all. Throughout their time of trouble, the Bakers laugh together, cry together, and pray together. And in the end, with Hashem's help, they emerge triumphant together!""--Judaicaplace.com",Bar/Bat mitzvah;Siblings;Jewish way of life;Fiction,Image;StillImage,image/jpeg,eng,item
hk0868,placeholder.jpg,Something's fishy,"Stein, Aidel;Zakon, Miriam Stark",2020,Menucha Publishers,"Brooklyn, NY",,,,,,,144 pages,21 cm,Baker's dozen,13,,,,,,,,Jewish families;Jewish way of life;Siblings;Fiction,Image;StillImage,image/jpeg,eng,item
hk0869,placeholder.jpg,Escape from Belgium : a father and son's story of survival,"Heller, Esther Susan;Worch, Renee",2020,Menucha Publishers,"Brooklyn, NY",,,,,,photographs;maps,142 pages,22 cm,Escape series,,,,Maps on endpapers.,,,,,"Holocaust, Jewish (1939-1945);Belgium;Antwerp (Belgium);Personal narratives;Escapes;History;20th century;Europe",Image;StillImage,image/jpeg,eng,item
hk0870,placeholder.jpg,Escape from the Neve Tzuf fire : an Israeli family's story of survival,"Ben Shachar, Chaya Sara",2020,Menucha Publishers,"Brooklyn, NY",,,,,,photographs;maps,114 pages,22 cm,Escape series,,,,Maps on endpapers.,,,,,Jewish families;Bank;Forest fires;History;21st century;Terrorism;West Bank,Image;StillImage,image/jpeg,eng,item
hk0871,placeholder.jpg,Production! : a novel,"Roteman, Ellen",2020,Menucha Publishers,"Brooklyn, NY",,,,,,,202 pages,24 cm,,,,,,,,,"""My stomach jumps with anxiety. I have to make choir - I just have to! That feeling of being up there with all eyes on me ... that sense of strength as my voice transports people to where the story needs them to go ..."" Tenth grader Chava Abrams is enthralled by her school's production--with its colorful costumes, dazzling choreography, and stunning sets. Her greatest ambition is to get a solo and be named assistant choir head. It's the first step in her grand plan--and her plan has got to succeed. But when Chava discovers a friend's painful secret, she's torn between her deepest desire and her friend's happiness. How will she make the right choice before the curtains open? Popular author Ellen Roteman presents a powerful story about the force of friendship in choosing the roles we play-- both onstage and behind the scenes. From tryouts to dress rehearsals, fundraising bake sales to last-minute technical glitches, readers will agree that this production deserves a standing ovation.""--Amazon.com",Children's choirs;Friendship;Orthodox Judaism;United States;Haredi and religious literature;Fiction;Religious fiction,Image;StillImage,image/jpeg,eng,item
hk0872,placeholder.jpg,Secrets in disguise,"Garber, Susie",2020,Menucha Publishers,"Brooklyn, NY",,,,,,,198 pages,24 cm,,,,,,,,,"""Fraidy Mintz has been harboring a dark and dangerous secret for over sixty years. One day she reveals it to Miri, an inquiring young reporter. Miri wants to see justice done, but the outcome could be terrifying. Suffering from bitterness over her own painful secret, Miri must make a fateful decision that will affect her life and those around her. Popular author Susie Garber transports readers back to Miami in 1942, when rampant anti-Semitism meant ""No Jews Allowed"" signs on hotel doors; when air raid sirens, blackouts, and German ships trying to invade Florida were an ongoing threat; and when ration cards and Jewish refugees escaping from war-torn Europe were daily realities. Readers will be captivated by this emotionally gripping and suspenseful novel as Miri courageously uncovers disturbing secrets in disguise.""--Amazon.com","World War II, 1939-1945;Miami (Florida);Florida;Fiction;Historical fiction;Thrillers",Image;StillImage,image/jpeg,eng,item
hk0873,placeholder.jpg,The mystery of the lost watch,"Biniashvili, Freidele Galya Soban",2020,Menucha Publishers,"Brooklyn, NY",,,,,,,124 pages,22 cm,,,,,Includes recipes.,,Includes bibliographical references.,,"""Ten-year-old Yudi Levy and his older brother, Shua, are shocked to discover a precious gold pocket watch at snowy Mount Royal Park, Quebec. Will the watch's unusual markings--an engraved menorah and unclear Hebrew letters--lead the brothers to its owner? The whole Levy family joins the search, but they keep hitting dead ends. Readers of The Mystery of the Lost Watch will enjoy a fascinating journey through Canadian life in the 1950s. Join the Levys as they try to find the watch's true owner--while racing against the clock.""--Amazon.com","Brothers;Parc du Mont-Royal (Montreal, Quebec);Quebec (Canada);Montreal (Quebec);Detective and mystery;Fiction;Haredi and religious literature",Image;StillImage,image/jpeg,eng,item
hk0874,placeholder.jpg,Turf wars,"Greenfield, A",2020,Menucha Publishers,"Brooklyn, NY",,,,,,,367 pages,24 cm,,,,,,,,,"""Where is Yonah Katz? Yonah Katz, an unassuming bookkeeper, has disappeared. In the frantic search to find him, his son Baruch is thrown into the unfamiliar world that lies beyond the beis midrash. Baruch's brother, Gedalya, a perpetually unsuccessful businessman, joins the desperate search. On the other side of town, Gabe, son of a Mafia boss, knows there's nothing more important than the family business. So why is he searching for something more? Gabe's cousin Tony, son of the rival Mafia boss, doesn't have the heart to hurt others, but he's terrified of angering his explosive father. Which ill-equipped cousin will become the family's heir in its long-anticipated turf war? In this engrossing thriller, dark secrets intensify as the search for Yonah Katz reveals shocking truths. Will anyone's life ever be the same again?""--Amazon.com",Missing persons;Organized crime;Orthodox Judaism;United States;Fiction;Thrillers,Image;StillImage,image/jpeg,eng,item
hk0875,placeholder.jpg,Wherever you are : a novel,"Sumner, Sara",2020,Menucha Publishers,"Brooklyn, NY",,,,,,,319 pages,24 cm,,,,,,,,,"""Eighteen-year-old Megan Ashby leaves behind her comfortable life in California, her lavish house, and hired help, for a year abroad in the cramped quarters of a Jerusalem seminary. Her family is outraged and they demand that she stop exploring her Jewish roots. Can Megan forge ahead despite her questions and doubts, and connect to the path she knows is true? In the shtetl of Szeclow, in war-torn Poland, the Zaslovsky family reels from a shocking calamity. Will sisters Shprintze and Goldie cling to their faith and their relationship or will the trauma of the war tear them apart? In this heartwarming historical novel, talented author Sara Sumner takes readers on a fascinating journey spanning cultures and continents. Whether in a close-knit European town or bustling New York City; the luxury of Los Angeles or the cobblestone streets of the Old City, a person can always come back to their true home.""--Amazon.com",Jewish women;Faith (Judaism);Young adult fiction;Fiction;Historical fiction,Image;StillImage,image/jpeg,eng,item
hk0876,placeholder.jpg,Party time,"Klein, Leah",2020,Menucha Publishers,"Brooklyn, NY",,,,,,,149 pages,22 cm,BY Times,6,,,,,,,"""When the Chinns throw a fabulous catered bas mitzvah party, it's a tough act for Chani Kaufman to follow. How can her bas mitzvah possibly top theirs--especially since her family is strapped for money? Party plans take a backseat when color war breaks out in school, splitting apart classes, friendships--and even Chinky and Pinky, those inseparable twins. Chani's got no time to worry about a bas mitzvah: with her team captain out sick, it's up to her to lead her team to victory. The problem is, they won't listen to a word she says! You'll find all the girls you've grown to love, and meet some great new characters--spunky Chani Kaufman, mysterious Miss Karlin, and even a high-flying pilot--in B.Y. Times #6: Party Time.""--Amazon.com.",Jewish girls;Jewish way of life;Bar/Bat mitzvah;Fiction,Image;StillImage,image/jpeg,eng,item
hk0877,placeholder.jpg,The Kichel collection : everyone's favorite family,"Stein, Bracha;Judowitz, Chani",2020,Menucha Publishers,"Brooklyn, NY",,,,,,color illustrations,"xii, 98 pages",35 cm,The Kichel collection,1,,,Comic strip.,,,,"""Here Comes the Frum World's Funniest Family. Finally, the book you've been waiting for! Join Yechiel and Nechama and their irresistible brood as they bravely strive to survive life in the frum lane.The Kichel Collection features ninety comics packed with hilarious observations and penetrating social commentary -- plus a family tree, answers to fascinating trivia questions, and an exclusive interview with the Kichels themselves. The Kichel Collection -- a book that will have your whole family laughing.""--Back cover.",Jewish families;Orthodox Judaism;Jewish wit and humor;Pictorial works;Wit and humor;Graphic novels;Fiction,Image;StillImage,image/jpeg,eng,item
